order_id,date,description,supplier,supplier_country,amount,unit_price,total,category_level_1,category_level_2,category_level_3,cost_centre,plant,plant_id,region
ORD-001,2024-03-15,Spherical roller bearing for main shaft assembly,SKF Group,SE,12,485.50,5826.00,Direct,Bearings & Seals,Spherical roller bearing,CC-100-Production,US-East Plant,PLANT-US-E,North America
ORD-002,2024-06-22,Cloud storage subscription for data warehouse,Amazon Web Services,US,1,24000.00,24000.00,Indirect,IT & Software,SaaS subscription,CC-400-IT,Germany-North,PLANT-DE-N,Europe
ORD-003,2024-09-10,Fiber cement roofing panels for facility,James Hardie,AU,200,45.00,9000.00,Indirect,Facilities & Utilities,Building materials,CC-200-Maintenance,US-West Plant,PLANT-US-W,North America
ORD-004,2024-11-05,Professional consulting for process optimization,McKinsey & Company,US,1,75000.00,75000.00,Indirect,Professional Services,Business consulting,CC-300-Engineering,Germany-South,PLANT-DE-S,Europe
ORD-005,2025-01-18,Office printer paper and supplies,Staples Inc,US,50,32.00,1600.00,Indirect,Office Supplies,Office consumables,CC-800-Admin,Vietnam Plant,PLANT-VN,Asia
